{
  "migration_id": "governance-history-refresh-r5-20260909-appsdk",
  "source_project_id": "appsdk",
  "canonical_project_cwd": "/Users/fanzhang/Documents/github/appsdk",
  "source_schema_version": "v1-legacy",
  "target_schema_version": "collab-v1",
  "source_snapshot_digest": "sha256:ca1bde6588224eaf8706050d9e95ccac095de14d248bfd2d6a6b8b2019bca16d",
  "source_epoch": null,
  "target_epoch": "unassigned-fresh-inspect-20260909",
  "project_admission": "reset_required",
  "owner_authority": "operator-required",
  "blocker_code": "SOURCE_PROJECTION_MUTABLE_UNRESOLVED_GIT_CONFLICTS",
  "first_failed_boundary": "snapshot",
  "mapping_status": "planned",
  "records": [
    {
      "source_record_id": ".agent-collab/mailbox-digest-list",
      "source_record_type": "mailbox-inventory",
      "source_record_digest": "sha256:e6135c72113e850435e75d6d6811f52726bab1d18bf44c1c6f1a8c5eef24e093",
      "source_disposition": "adapt_reconcile",
      "owner_authority": "operator-required",
      "blocker_code": null,
      "first_failed_boundary": null,
      "target_epoch": "unassigned-fresh-inspect-20260909",
      "target_sequence": null,
      "target_entity_id": null,
      "agent_id": null,
      "runtime_id": null,
      "binding_id": null,
      "endpoint_generation": null,
      "appsdk_record_ref": null,
      "appsdk_record_digest": null,
      "mapping_class": "adapt",
      "mapping_status": "planned",
      "raw_archive_ref": null,
      "exact_error": null,
      "first_failed_boundary": null,
      "created_at": "2026-09-09T23:30:21Z",
      "updated_at": "2026-09-09T23:30:21Z"
    },
    {
      "source_record_id": ".agent-collab/server/events.jsonl",
      "source_record_type": "events-projection",
      "source_record_digest": "sha256:0623b8fdb7b4583e810d0c78bb245da3009e68a123a1f8e347f9357fd6e02f40",
      "source_disposition": "archive_only",
      "owner_authority": "operator-required",
      "blocker_code": "SOURCE_PROJECTION_MUTABLE",
      "target_epoch": "unassigned-fresh-inspect-20260909",
      "target_sequence": null,
      "target_entity_id": null,
      "runtime_id": null,
      "binding_id": null,
      "endpoint_generation": null,
      "mapping_class": "unknown",
      "mapping_status": "planned",
      "raw_archive_ref": null,
      "exact_error": "SOURCE_PROJECTION_MUTABLE_DURING_INSPECTION:events_advanced_from_5244_to_5300",
      "first_failed_boundary": "snapshot",
      "created_at": "2026-09-09T23:30:21Z",
      "updated_at": "2026-09-09T23:30:21Z"
    },
    {
      "source_record_id": ".agent-collab/server/journal.jsonl",
      "source_record_type": "journal-projection",
      "source_record_digest": "sha256:ca1bde6588224eaf8706050d9e95ccac095de14d248bfd2d6a6b8b2019bca16d",
      "source_disposition": "rebuild_required",
      "owner_authority": "operator-required",
      "blocker_code": "UNRESOLVED_GIT_CONFLICTS",
      "target_epoch": "unassigned-fresh-inspect-20260909",
      "target_sequence": null,
      "target_entity_id": null,
      "runtime_id": null,
      "binding_id": null,
      "endpoint_generation": null,
      "mapping_class": "reset",
      "mapping_status": "planned",
      "raw_archive_ref": null,
      "exact_error": "SOURCE_PROJECTION_MUTABLE_UNRESOLVED_GIT_CONFLICTS:5",
      "first_failed_boundary": "snapshot",
      "created_at": "2026-09-09T23:30:21Z",
      "updated_at": "2026-09-09T23:30:21Z"
    }
  ],
  "source_repo": "/Users/fanzhang/Documents/github/appsdk",
  "source_branch": "chore/project-memory-snapshot",
  "source_head": "2d14efed9d7f6454d119cb7a1aea24a384e966e0",
  "source_tree": "728960b0e100201045317a28e740d0e58e0558d4",
  "archive_ref": null,
  "archive_digest": null,
  "created_at": "2026-09-09T23:30:21Z",
  "updated_at": "2026-09-09T23:30:21Z"
}
