{
  "migration_id": "governance-history-refresh-r5-20260909-routecodex",
  "source_project_id": "routecodex",
  "canonical_project_cwd": "/Users/fanzhang/Documents/github/routecodex",
  "source_schema_version": "v1-legacy",
  "target_schema_version": "collab-v1",
  "source_snapshot_digest": "sha256:f7d88a6111b44c6a5ec5fccc1592cea49bd33f0170ffc5581c970cd89f0747f2",
  "source_epoch": null,
  "target_epoch": "unassigned-fresh-inspect-20260909",
  "project_admission": "reset_required",
  "owner_authority": "operator-required",
  "blocker_code": "SOURCE_PROJECTION_MUTABLE_STALE_OWNER_GRAPH",
  "first_failed_boundary": "snapshot",
  "mapping_status": "planned",
  "records": [
    {
      "source_record_id": ".agent-collab/mailbox-digest-list",
      "source_record_type": "mailbox-inventory",
      "source_record_digest": "sha256:49d79aaab2d32b2da2e20a1b1aa8cc1e263593fcae2c8dc9047478925dcd6b5c",
      "source_disposition": "adapt_reconcile",
      "owner_authority": "operator-required",
      "blocker_code": null,
      "target_epoch": "unassigned-fresh-inspect-20260909",
      "target_sequence": null,
      "target_entity_id": null,
      "agent_id": null,
      "runtime_id": null,
      "binding_id": null,
      "endpoint_generation": null,
      "appsdk_record_ref": null,
      "appsdk_record_digest": null,
      "mapping_class": "adapt",
      "mapping_status": "planned",
      "raw_archive_ref": null,
      "exact_error": null,
      "first_failed_boundary": null,
      "created_at": "2026-09-09T23:30:21Z",
      "updated_at": "2026-09-09T23:30:21Z"
    },
    {
      "source_record_id": ".agent-collab/server/events.jsonl",
      "source_record_type": "events-projection",
      "source_record_digest": "sha256:264aca654e42a754e5662b06936be933a3aa29d0209ea9032d32332da78b1521",
      "source_disposition": "archive_only",
      "owner_authority": "operator-required",
      "blocker_code": "SOURCE_PROJECTION_MUTABLE",
      "target_epoch": "unassigned-fresh-inspect-20260909",
      "target_sequence": null,
      "target_entity_id": null,
      "runtime_id": null,
      "binding_id": null,
      "endpoint_generation": null,
      "mapping_class": "unknown",
      "mapping_status": "planned",
      "raw_archive_ref": null,
      "exact_error": "SOURCE_PROJECTION_MUTABLE_DURING_INSPECTION:events_advanced_from_26251_to_26277",
      "first_failed_boundary": "snapshot",
      "created_at": "2026-09-09T23:30:21Z",
      "updated_at": "2026-09-09T23:30:21Z"
    },
    {
      "source_record_id": ".agent-collab/server/journal.jsonl",
      "source_record_type": "journal-projection",
      "source_record_digest": "sha256:d38626897916682a6d491367de2564eada6119eccc1f99fe13c985cd91469390",
      "source_disposition": "rebuild_required",
      "owner_authority": "operator-required",
      "blocker_code": "STALE_OWNER_GRAPH",
      "target_epoch": "unassigned-fresh-inspect-20260909",
      "target_sequence": null,
      "target_entity_id": null,
      "runtime_id": null,
      "binding_id": null,
      "endpoint_generation": null,
      "mapping_class": "reset",
      "mapping_status": "planned",
      "raw_archive_ref": null,
      "exact_error": "SOURCE_PROJECTION_MUTABLE_STALE_OWNER_GRAPH:dirty_root_and_378_unmerged_branches",
      "first_failed_boundary": "snapshot",
      "created_at": "2026-09-09T23:30:21Z",
      "updated_at": "2026-09-09T23:30:21Z"
    }
  ],
  "source_repo": "/Users/fanzhang/Documents/github/routecodex",
  "source_branch": "codex/root-dirty-recovery-0908",
  "source_head": "d876adea1d5c57a73cf643f5c8d89b56bd3d42c4",
  "source_tree": "88edaa554f16ff17cd4e28bc49ac52c5fc2a84ae",
  "archive_ref": null,
  "archive_digest": null,
  "created_at": "2026-09-09T23:30:21Z",
  "updated_at": "2026-09-09T23:30:21Z"
}
