{
  "migration_id": "governance-history-refresh-r5-20260909-codexapp",
  "source_project_id": "codexapp",
  "canonical_project_cwd": "/Users/fanzhang/Documents/github/codexapp",
  "source_schema_version": "codexapp-transport-journal-v1",
  "target_schema_version": "collab-v1",
  "source_snapshot_digest": "sha256:77b2a730b6dc34dca560bef4e9139e5553bdca91ba5456530f2c8219f3d189aa",
  "source_epoch": null,
  "target_epoch": "unassigned-fresh-inspect-20260909",
  "project_admission": "needs_operator",
  "owner_authority": "operator-required",
  "blocker_code": "NATIVE_APPSERVER_ADMISSION_UNVERIFIED",
  "first_failed_boundary": "runtime-admission",
  "mapping_status": "planned",
  "records": [
    {
      "source_record_id": "/Users/fanzhang/.codex-communication/journal.jsonl",
      "source_record_type": "external-transport-journal",
      "source_record_digest": "sha256:c3d995d870cd45a3887c1f3eddba4e2a214db6b60158f3b037ed4fc826f485a4",
      "source_disposition": "archive_only",
      "owner_authority": "operator-required",
      "blocker_code": "NATIVE_APPSERVER_ADMISSION_UNVERIFIED",
      "target_epoch": "unassigned-fresh-inspect-20260909",
      "target_sequence": null,
      "target_entity_id": null,
      "agent_id": null,
      "runtime_id": null,
      "binding_id": null,
      "endpoint_generation": null,
      "appsdk_record_ref": null,
      "appsdk_record_digest": null,
      "mapping_class": "unknown",
      "mapping_status": "planned",
      "raw_archive_ref": null,
      "exact_error": "NATIVE_APPSERVER_ADMISSION_UNVERIFIED:communication_socket_has_no_successful_initialize_or_capability_receipt",
      "first_failed_boundary": "runtime-admission",
      "created_at": "2026-09-09T23:30:21Z",
      "updated_at": "2026-09-09T23:30:21Z"
    }
  ],
  "source_repo": null,
  "source_branch": null,
  "source_head": null,
  "source_tree": null,
  "archive_ref": null,
  "archive_digest": null,
  "created_at": "2026-09-09T23:30:21Z",
  "updated_at": "2026-09-09T23:30:21Z"
}
