{
  "migration_id": "governance-history-refresh-r5-20260909-collab",
  "source_project_id": "collab",
  "canonical_project_cwd": "/Volumes/extension/code/collab",
  "source_schema_version": "v1-legacy",
  "target_schema_version": "collab-v1",
  "source_snapshot_digest": "sha256:c47e0f95b388809274ae2c43b8a23289e3d92e6afa6a61ea21033a7491fffc83",
  "source_epoch": null,
  "target_epoch": "unassigned-fresh-inspect-20260909",
  "project_admission": "reset_required",
  "owner_authority": "operator-required",
  "blocker_code": "SOURCE_PROJECTION_MUTABLE_ONE_WRITER_UNPROVEN",
  "first_failed_boundary": "snapshot",
  "mapping_status": "planned",
  "records": [
    {
      "source_record_id": ".agent-collab/mailbox-digest-list",
      "source_record_type": "mailbox-inventory",
      "source_record_digest": "sha256:6fe9bba474b61d0571dec0747f795c2395dbbf832f70f63c4e4638f2f6b1dcb7",
      "source_disposition": "adapt_reconcile",
      "owner_authority": "operator-required",
      "blocker_code": null,
      "first_failed_boundary": null,
      "target_epoch": "unassigned-fresh-inspect-20260909",
      "target_sequence": null,
      "target_entity_id": null,
      "agent_id": null,
      "runtime_id": null,
      "binding_id": null,
      "endpoint_generation": null,
      "appsdk_record_ref": null,
      "appsdk_record_digest": null,
      "mapping_class": "adapt",
      "mapping_status": "planned",
      "raw_archive_ref": null,
      "exact_error": null,
      "first_failed_boundary": null,
      "created_at": "2026-09-09T23:30:21Z",
      "updated_at": "2026-09-09T23:30:21Z"
    },
    {
      "source_record_id": ".agent-collab/server/events.jsonl",
      "source_record_type": "events-projection",
      "source_record_digest": "sha256:501cb177fbae3e822d046d6c3e0f897612721b1b9bb4ceb3f50c19f4f59cf9d1",
      "source_disposition": "archive_only",
      "owner_authority": "operator-required",
      "blocker_code": "SOURCE_PROJECTION_MUTABLE",
      "target_epoch": "unassigned-fresh-inspect-20260909",
      "target_sequence": null,
      "target_entity_id": null,
      "agent_id": null,
      "runtime_id": null,
      "binding_id": null,
      "endpoint_generation": null,
      "appsdk_record_ref": null,
      "appsdk_record_digest": null,
      "mapping_class": "unknown",
      "mapping_status": "planned",
      "raw_archive_ref": null,
      "exact_error": "SOURCE_PROJECTION_MUTABLE_DURING_INSPECTION:events_advanced_from_476_to_478",
      "first_failed_boundary": "snapshot",
      "created_at": "2026-09-09T23:30:21Z",
      "updated_at": "2026-09-09T23:30:21Z"
    },
    {
      "source_record_id": ".agent-collab/server/journal.jsonl",
      "source_record_type": "journal-projection",
      "source_record_digest": "sha256:c47e0f95b388809274ae2c43b8a23289e3d92e6afa6a61ea21033a7491fffc83",
      "source_disposition": "rebuild_required",
      "owner_authority": "operator-required",
      "blocker_code": "ONE_WRITER_UNPROVEN",
      "target_epoch": "unassigned-fresh-inspect-20260909",
      "target_sequence": null,
      "target_entity_id": null,
      "agent_id": null,
      "runtime_id": null,
      "binding_id": null,
      "endpoint_generation": null,
      "appsdk_record_ref": null,
      "appsdk_record_digest": null,
      "mapping_class": "reset",
      "mapping_status": "planned",
      "raw_archive_ref": null,
      "exact_error": "ONE_WRITER_UNPROVEN:16_exact_collab_serve_processes;SOURCE_PROJECTION_MUTABLE",
      "first_failed_boundary": "writer-admission",
      "created_at": "2026-09-09T23:30:21Z",
      "updated_at": "2026-09-09T23:30:21Z"
    }
  ],
  "source_repo": "/Volumes/extension/code/collab",
  "source_branch": "codex/v2-cordis-architecture",
  "source_head": "064824c375a720450c43f4829679bb8e45d4a1d1",
  "source_tree": "7f0bfc31628af30604a3b10e13098ac166bcd236",
  "archive_ref": null,
  "archive_digest": null,
  "created_at": "2026-09-09T23:30:21Z",
  "updated_at": "2026-09-09T23:30:21Z"
}
